ndm/triton/pinned_autotune_configs.json
{
  "_comment": "Pinned Triton autotune configs (kernel_name -> autotune_key -> config). Generated by ndm.triton.pin_autotune RECORD mode.",
  "kernels": {
    "_layer_norm_bwd_kernel": {
      "[\"1792\",\"False\",\"False\",\"True\",\"False\",\"False\",\"torch.bfloat16\",\"torch.bfloat16\",\"torch.bfloat16\",\"torch.bfloat16\",\"torch.float32\",\"torch.float32\"]": {
        "kwargs": {},
        "maxnreg": null,
        "num_ctas": 1,
        "num_stages": 3,
        "num_warps": 8
      },
      "[\"1792\",\"False\",\"True\",\"True\",\"False\",\"False\",\"torch.float32\",\"torch.bfloat16\",\"torch.bfloat16\",\"torch.bfloat16\",\"torch.float32\",\"torch.float32\",\"torch.float32\"]": {
        "kwargs": {},
        "maxnreg": null,
        "num_ctas": 1,
        "num_stages": 3,
        "num_warps": 32
      },
      "[\"1792\",\"True\",\"False\",\"True\",\"False\",\"False\",\"torch.float32\",\"torch.bfloat16\",\"torch.bfloat16\",\"torch.bfloat16\",\"torch.float32\",\"torch.float32\",\"torch.float32\"]": {
        "kwargs": {},
        "maxnreg": null,
        "num_ctas": 1,
        "num_stages": 3,
        "num_warps": 16
      },
      "[\"1792\",\"True\",\"True\",\"True\",\"False\",\"False\",\"torch.float32\",\"torch.bfloat16\",\"torch.bfloat16\",\"torch.bfloat16\",\"torch.float32\",\"torch.float32\",\"torch.float32\",\"torch.float32\"]": {
        "kwargs": {},
        "maxnreg": null,
        "num_ctas": 1,
        "num_stages": 3,
        "num_warps": 4
      },
      "[\"2176\",\"False\",\"True\",\"True\",\"False\",\"False\",\"torch.float32\",\"torch.bfloat16\",\"torch.bfloat16\",\"torch.bfloat16\",\"torch.float32\",\"torch.float32\",\"torch.float32\"]": {
        "kwargs": {},
        "maxnreg": null,
        "num_ctas": 1,
        "num_stages": 3,
        "num_warps": 32
      },
      "[\"2176\",\"True\",\"False\",\"True\",\"False\",\"False\",\"torch.float32\",\"torch.bfloat16\",\"torch.bfloat16\",\"torch.bfloat16\",\"torch.float32\",\"torch.float32\",\"torch.float32\"]": {
        "kwargs": {},
        "maxnreg": null,
        "num_ctas": 1,
        "num_stages": 3,
        "num_warps": 32
      },
      "[\"2176\",\"True\",\"True\",\"True\",\"False\",\"False\",\"torch.float32\",\"torch.bfloat16\",\"torch.bfloat16\",\"torch.bfloat16\",\"torch.float32\",\"torch.float32\",\"torch.float32\",\"torch.float32\"]": {
        "kwargs": {},
        "maxnreg": null,
        "num_ctas": 1,
        "num_stages": 3,
        "num_warps": 4
      }
    },
    "_layer_norm_fwd_1pass_kernel": {
      "[\"1792\",\"False\",\"False\",\"True\",\"False\",\"torch.bfloat16\",\"torch.bfloat16\",\"torch.bfloat16\",\"torch.float32\"]": {
        "kwargs": {},
        "maxnreg": null,
        "num_ctas": 1,
        "num_stages": 3,
        "num_warps": 2
      },
      "[\"1792\",\"False\",\"True\",\"True\",\"False\",\"torch.bfloat16\",\"torch.bfloat16\",\"torch.bfloat16\",\"torch.float32\",\"torch.float32\"]": {
        "kwargs": {},
        "maxnreg": null,
        "num_ctas": 1,
        "num_stages": 3,
        "num_warps": 32
      },
      "[\"1792\",\"True\",\"True\",\"True\",\"False\",\"torch.bfloat16\",\"torch.bfloat16\",\"torch.bfloat16\",\"torch.float32\",\"torch.float32\",\"torch.float32\"]": {
        "kwargs": {},
        "maxnreg": null,
        "num_ctas": 1,
        "num_stages": 3,
        "num_warps": 2
      },
      "[\"2176\",\"False\",\"True\",\"True\",\"False\",\"torch.bfloat16\",\"torch.bfloat16\",\"torch.bfloat16\",\"torch.float32\",\"torch.float32\"]": {
        "kwargs": {},
        "maxnreg": null,
        "num_ctas": 1,
        "num_stages": 3,
        "num_warps": 32
      },
      "[\"2176\",\"True\",\"True\",\"True\",\"False\",\"torch.bfloat16\",\"torch.bfloat16\",\"torch.bfloat16\",\"torch.float32\",\"torch.float32\",\"torch.float32\"]": {
        "kwargs": {},
        "maxnreg": null,
        "num_ctas": 1,
        "num_stages": 3,
        "num_warps": 4
      }
    },
    "causal_conv1d_bwd_kernel": {
      "[\"3840\",\"4\",\"8\",\"torch.bfloat16\",\"torch.bfloat16\",\"torch.bfloat16\",\"torch.bfloat16\",\"torch.bfloat16\",\"torch.float32\"]": {
        "kwargs": {
          "BD": 64
        },
        "maxnreg": null,
        "num_ctas": 1,
        "num_stages": 3,
        "num_warps": 8
      }
    },
    "causal_conv1d_fwd_kernel": {
      "[\"3840\",\"4\",\"8\",\"torch.bfloat16\",\"torch.bfloat16\",\"torch.bfloat16\"]": {
        "kwargs": {
          "BD": 64
        },
        "maxnreg": null,
        "num_ctas": 1,
        "num_stages": 3,
        "num_warps": 4
      }
    },
    "chunk_gated_delta_rule_bwd_kernel_dhu_blockdim64": {
      "[\"30\",\"128\",\"128\",\"64\",\"False\",\"True\",\"False\",\"torch.bfloat16\",\"torch.bfloat16\",\"torch.bfloat16\",\"torch.float32\",\"torch.bfloat16\",\"torch.bfloat16\",\"torch.bfloat16\",\"torch.bfloat16\"]": {
        "kwargs": {
          "BV": 32
        },
        "maxnreg": null,
        "num_ctas": 1,
        "num_stages": 1,
        "num_warps": 4
      }
    },
    "chunk_gated_delta_rule_fwd_kernel_h_blockdim64": {
      "[\"30\",\"128\",\"128\",\"64\",\"True\",\"False\",\"torch.bfloat16\",\"torch.bfloat16\",\"torch.bfloat16\",\"torch.bfloat16\",\"torch.float32\",\"torch.bfloat16\"]": {
        "kwargs": {
          "BV": 32
        },
        "maxnreg": null,
        "num_ctas": 1,
        "num_stages": 2,
        "num_warps": 4
      }
    },
    "chunk_gdn2_bwd_kernel_intra": {
      "[\"32\",\"4\",\"64\",\"torch.bfloat16\",\"torch.bfloat16\",\"torch.float32\",\"torch.bfloat16\",\"torch.float32\",\"torch.float32\",\"torch.float32\",\"torch.bfloat16\",\"torch.float32\",\"torch.bfloat16\",\"torch.float32\",\"torch.float32\",\"torch.float32\"]": {
        "kwargs": {},
        "maxnreg": null,
        "num_ctas": 1,
        "num_stages": 2,
        "num_warps": 1
      }
    },
    "chunk_gdn2_bwd_kernel_wy_dqkg_fused": {
      "[\"64\",\"False\",\"torch.bfloat16\",\"torch.bfloat16\",\"torch.bfloat16\",\"torch.bfloat16\",\"torch.float32\",\"torch.bfloat16\",\"torch.bfloat16\",\"torch.bfloat16\",\"torch.bfloat16\",\"torch.bfloat16\",\"torch.bfloat16\",\"torch.float32\",\"torch.float32\",\"torch.bfloat16\",\"torch.bfloat16\",\"torch.float32\",\"torch.float32\",\"torch.float32\",\"torch.float32\"]": {
        "kwargs": {
          "BK": 32,
          "BV": 64
        },
        "maxnreg": null,
        "num_ctas": 1,
        "num_stages": 2,
        "num_warps": 4
      }
    },
    "chunk_gdn2_fwd_kernel_inter_solve_fused": {
      "[\"30\",\"128\",\"16\",\"torch.bfloat16\",\"torch.bfloat16\",\"torch.float32\",\"torch.bfloat16\",\"torch.bfloat16\",\"torch.float32\",\"torch.bfloat16\"]": {
        "kwargs": {
          "BK": 32
        },
        "maxnreg": null,
        "num_ctas": 1,
        "num_stages": 3,
        "num_warps": 2
      }
    },
    "chunk_gdn2_fwd_kernel_intra_token_parallel": {
      "[\"128\",\"30\",\"torch.bfloat16\",\"torch.bfloat16\",\"torch.float32\",\"torch.bfloat16\",\"torch.bfloat16\",\"torch.float32\"]": {
        "kwargs": {
          "BH": 4
        },
        "maxnreg": null,
        "num_ctas": 1,
        "num_stages": 3,
        "num_warps": 1
      }
    },
    "chunk_gla_fwd_kernel_o": {
      "[\"64\",\"torch.bfloat16\",\"torch.bfloat16\",\"torch.float32\",\"torch.bfloat16\",\"torch.bfloat16\",\"torch.bfloat16\"]": {
        "kwargs": {
          "BK": 64,
          "BV": 64
        },
        "maxnreg": null,
        "num_ctas": 1,
        "num_stages": 2,
        "num_warps": 8
      }
    },
    "chunk_kda_bwd_kernel_dAv": {
      "[\"30\",\"128\",\"128\",\"64\",\"64\",\"64\",\"torch.bfloat16\",\"torch.bfloat16\",\"torch.bfloat16\",\"torch.bfloat16\",\"torch.bfloat16\",\"torch.bfloat16\",\"torch.float32\"]": {
        "kwargs": {},
        "maxnreg": null,
        "num_ctas": 1,
        "num_stages": 2,
        "num_warps": 2
      }
    },
    "chunk_local_cumsum_vector_kernel": {
      "[\"4\",\"30\",\"128\",\"64\",\"False\",\"False\",\"torch.float32\",\"torch.float32\"]": {
        "kwargs": {
          "BS": 16
        },
        "maxnreg": null,
        "num_ctas": 1,
        "num_stages": 3,
        "num_warps": 8
      },
      "[\"4\",\"30\",\"128\",\"64\",\"False\",\"True\",\"torch.float32\",\"torch.float32\"]": {
        "kwargs": {
          "BS": 16
        },
        "maxnreg": null,
        "num_ctas": 1,
        "num_stages": 3,
        "num_warps": 8
      }
    },
    "l2norm_bwd_kernel": {
      "[\"128\",\"120\",\"torch.bfloat16\",\"torch.float32\",\"torch.bfloat16\",\"torch.bfloat16\"]": {
        "kwargs": {
          "BT": 128
        },
        "maxnreg": null,
        "num_ctas": 1,
        "num_stages": 3,
        "num_warps": 16
      }
    },
    "l2norm_fwd_kernel": {
      "[\"128\",\"120\",\"torch.bfloat16\",\"torch.bfloat16\",\"torch.float32\"]": {
        "kwargs": {
          "BT": 32
        },
        "maxnreg": null,
        "num_ctas": 1,
        "num_stages": 3,
        "num_warps": 8
      }
    },
    "layer_norm_gated_bwd_kernel": {
      "[\"128\",\"120\",\"True\",\"False\",\"True\",\"torch.bfloat16\",\"torch.bfloat16\",\"torch.bfloat16\",\"torch.bfloat16\",\"torch.bfloat16\",\"torch.bfloat16\",\"torch.float32\",\"torch.float32\"]": {
        "kwargs": {
          "BT": 64
        },
        "maxnreg": null,
        "num_ctas": 1,
        "num_stages": 3,
        "num_warps": 16
      }
    },
    "layer_norm_gated_fwd_kernel": {
      "[\"128\",\"120\",\"True\",\"False\",\"False\",\"True\",\"torch.bfloat16\",\"torch.bfloat16\",\"torch.bfloat16\",\"torch.bfloat16\",\"torch.float32\"]": {
        "kwargs": {
          "BT": 32
        },
        "maxnreg": null,
        "num_ctas": 1,
        "num_stages": 3,
        "num_warps": 8
      }
    },
    "recompute_w_u_fwd_gdn2_kernel": {
      "[\"30\",\"128\",\"128\",\"64\",\"64\",\"64\",\"False\",\"torch.bfloat16\",\"torch.bfloat16\",\"torch.bfloat16\",\"torch.bfloat16\",\"torch.bfloat16\",\"torch.bfloat16\",\"torch.bfloat16\",\"torch.bfloat16\",\"torch.bfloat16\",\"torch.bfloat16\",\"torch.float32\"]": {
        "kwargs": {},
        "maxnreg": null,
        "num_ctas": 1,
        "num_stages": 3,
        "num_warps": 4
      },
      "[\"30\",\"128\",\"128\",\"64\",\"64\",\"64\",\"False\",\"torch.bfloat16\",\"torch.bfloat16\",\"torch.bfloat16\",\"torch.bfloat16\",\"torch.bfloat16\",\"torch.bfloat16\",\"torch.bfloat16\",\"torch.bfloat16\",\"torch.float32\"]": {
        "kwargs": {},
        "maxnreg": null,
        "num_ctas": 1,
        "num_stages": 3,
        "num_warps": 4
      }
    }
  }
}